{
  "contract": "portal-contract/1",
  "type": "res",
  "id": "3f2504e0-4f89-41d3-9a0c-0305e82c3301",
  "ts": 1719900000123,
  "nonce": "EBESExQVFhcYGRobHB0eHw",
  "principal": "owner",
  "key_id": "BgcICQoLDA0ODxAREhMUFQ",
  "funding": "member-subsidized",
  "ok": true,
  "result": { "text": "build ok\n", "surface_id": "term-1" },
  "sig": "AAECAwQFBgcICQoLDA0ODxAREhMUFRYXGBkaGxwdHh8gISIjJCUmJygpKissLS4vMDEyMzQ1Njc4OTo7PD0-Pw"
}
